{
  "brand": "Silueta",
  "category": "shapewear",
  "palette": ["#2B1B2E", "#C9748A", "#E8C9B0", "#F4EDE6", "#1A1015"],
  "logo": "brands/silueta/logo/silueta-wordmark.svg",
  "tone": "Cercana, segura de sí misma y sin culpas. Habla de comodidad, postura y confianza, no de bajar de peso. Tuteo colombiano cálido, frases cortas, cero vergüenza corporal. La faja es una aliada, no una solución a un 'defecto'.",
  "captions": {
    "h1Font": "Montserrat",
    "h2Font": "Montserrat",
    "baseFont": "Inter",
    "scriptFont": "Playfair Display",
    "accentColor": "#C9748A",
    "highlightColor": "#E8C9B0",
    "baseTextColor": "#F4EDE6",
    "outlineColor": "#1A1015",
    "contrastStrategy": "both",
    "diacriticsVerified": true
  },
  "voice": {
    "samples": [
      {
        "file": "brands/silueta/voice-samples/carolina-neutral-01.wav",
        "note": "Locutora principal Carolina, tono neutro conversacional, 22s, español CO. Base para clonación."
      },
      {
        "file": "brands/silueta/voice-samples/carolina-energetica-02.wav",
        "note": "Misma locutora, registro más energético para ganchos y ofertas, 18s."
      },
      {
        "file": "brands/silueta/voice-samples/carolina-calida-03.wav",
        "note": "Registro cálido/íntimo para testimonio y cierre, 20s."
      }
    ],
    "consent": true,
    "consentDate": "2026-06-14",
    "engine": "chatterbox"
  },
  "imageRights": {
    "releases": [
      {
        "modelId": "mdl-carolina-restrepo",
        "displayName": "Carolina R.",
        "faceRef": "brands/silueta/faces/carolina.embedding.json",
        "authorizedForPaid": true,
        "authorizedUntil": "2027-06-14"
      },
      {
        "modelId": "mdl-daniela-gomez",
        "displayName": "Daniela G.",
        "faceRef": "brands/silueta/faces/daniela.embedding.json",
        "authorizedForPaid": true,
        "authorizedUntil": "2026-12-31"
      },
      {
        "modelId": "mdl-invitada-ugc-julio",
        "displayName": "Invitada UGC (colaboración julio)",
        "faceRef": "brands/silueta/faces/invitada-julio.embedding.json",
        "authorizedForPaid": false
      }
    ]
  },
  "transitions": {
    "weights": {
      "hard-cut": 0.9,
      "action-cut-whip": 0.7,
      "match-cut": 0.55,
      "invisible-cut": 0.5,
      "zoom-punch": 0.4,
      "speed-ramp": 0.35,
      "crossfade": 0.2,
      "shape-mask": 0.3,
      "luma-matte": 0.15
    },
    "banned": ["glitch"],
    "notes": "Marca premium-accesible: corta duro en el beat y usa whip solo con movimiento real de cámara. Nada de glitch (rompe la percepción de calidad). Crossfade reservado a cierres mood/testimonio."
  },
  "color": {
    "temperature": "warm",
    "contrast": "medium",
    "saturation": "natural",
    "lut": "brands/silueta/luts/silueta-warm-natural.cube",
    "skinHueRange": [15, 50]
  },
  "copy": {
    "hookFormulas": [
      "¿Te ha pasado que {situacion_cotidiana}?",
      "Nadie te dice que {verdad_incomoda_compliant}",
      "Dejé de {molestia} cuando descubrí {producto}",
      "POV: {escena_de_uso_real}",
      "El error que todas cometemos al elegir faja",
      "3 razones por las que {producto} se volvió mi básico"
    ],
    "ctaFormulas": [
      "Consíguela con envío a toda Colombia — link en la bio",
      "Encuentra tu talla en el link de la bio",
      "Aprovecha antes de que se agote tu talla",
      "Escríbenos por WhatsApp y te asesoramos con tu talla",
      "Desliza para ver todas las referencias"
    ],
    "bannedWords": [
      "adelgaza",
      "adelgazar",
      "rollitos",
      "gorditos",
      "llantas",
      "baja de peso",
      "quema grasa",
      "reduce medidas",
      "pierde tallas",
      "milagro",
      "milagroso",
      "defecto",
      "arregla tu cuerpo",
      "antes y después"
    ],
    "toneNotes": "Prohibido cualquier claim de pérdida de peso o vergüenza corporal. Se habla de moldear, comodidad, postura, firmeza y confianza — nunca de 'corregir' el cuerpo. 'Compresión' se traduce en beneficio sentido, no en promesa médica."
  },
  "performance": {
    "records": [
      {
        "videoId": "vid-2026-07-19-ps-hook02",
        "date": "2026-07-19",
        "platform": "tiktok",
        "branch": "problema-solucion",
        "hookId": "ps-teha-pasado",
        "retention3s": 0.71,
        "ctr": 0.038,
        "conversion": 0.019,
        "note": "Gancho '¿Te ha pasado que la faja se te enrolla?' — mejor retención 3s del mes."
      },
      {
        "videoId": "vid-2026-07-28-of-hook01",
        "date": "2026-07-28",
        "platform": "instagram",
        "branch": "oferta-urgencia",
        "hookId": "of-dato-stock",
        "retention3s": 0.58,
        "ctr": 0.052,
        "conversion": 0.027,
        "note": "Oferta con dato de stock; CTR alto pero retención media. Se archiva el gancho lento anterior."
      },
      {
        "videoId": "vid-2026-08-11-ugc-hook03",
        "date": "2026-08-11",
        "platform": "tiktok",
        "branch": "ugc-testimonio",
        "hookId": "ugc-dejede",
        "retention3s": 0.66,
        "ctr": 0.041,
        "conversion": 0.022,
        "note": "Testimonio literal 'Dejé de acomodarme la faja todo el día'. Autenticidad ganó."
      },
      {
        "videoId": "vid-2026-08-20-dd-hook01",
        "date": "2026-08-20",
        "platform": "meta",
        "branch": "demo-directa",
        "hookId": "dd-resultado-primero",
        "retention3s": 0.49,
        "ctr": 0.029,
        "conversion": 0.014,
        "note": "Demo con resultado primero; retención floja en 9:16, mejor en 4:5. Bajo rendimiento en pauta."
      }
    ],
    "winningHooks": ["ps-teha-pasado", "ugc-dejede", "of-dato-stock"],
    "winningBranches": ["problema-solucion", "ugc-testimonio"],
    "winningMusicMoods": ["confianza-elegante", "energia-latina-suave"],
    "archived": ["of-gancho-lento-v1", "dd-feature-first-v1", "ps-pregunta-generica-v0"]
  },
  "musicMoods": [
    {
      "name": "confianza-elegante",
      "tags": ["deep-house", "elegante", "femenino", "sintetizador-cálido", "premium"],
      "bpm": [100, 115]
    },
    {
      "name": "energia-latina-suave",
      "tags": ["afro-latin-pop", "percusión-suave", "optimista", "guitarra"],
      "bpm": [95, 110]
    },
    {
      "name": "urgencia-oferta",
      "tags": ["future-bass", "punchy", "riser", "energético", "beat-marcado"],
      "bpm": [120, 132]
    },
    {
      "name": "intimo-testimonio",
      "tags": ["lo-fi", "piano", "cálido", "cercano", "acústico"],
      "bpm": [80, 92]
    }
  ],
  "sonicLogo": "brands/silueta/sonic-logo/silueta-sonic-logo.wav",
  "degraded": []
}
